{
  "version": "v2.0.4",
  "owner": "uDOS-core",
  "schema": "schemas/ok-agent-capability-contract.schema.json",
  "summary": "Core-owned capability contract for OK Agent participation without transferring runtime authority.",
  "required_fields": [
    "agent_id",
    "role",
    "capabilities",
    "autonomy_class",
    "budget_group",
    "network_required",
    "audit_required"
  ],
  "autonomy_classes": [
    "class0_manual_only",
    "class1_bounded_local",
    "class2_deferred_managed",
    "class3_contributor",
    "class4_restricted_high_trust"
  ],
  "owners": {
    "contract": "uDOS-core",
    "managed_policy": "uDOS-wizard",
    "contributor_lane": "uDOS-dev"
  }
}
